{
  "schema_version": "validation-receipt/v1",
  "dispatch_id": "flywheel-i18f-02f015",
  "callback_ref": {
    "transport": "manual_fixture",
    "session": "flywheel",
    "pane": 1,
    "kind": "DONE",
    "received_at": "2026-05-09T06:16:22Z",
    "raw_ref": "pending ntm callback"
  },
  "status": "pass",
  "failure_class": null,
  "retry_policy": "none",
  "recovery_hint": "None.",
  "failure_classes": [],
  "evidence": [
    {
      "type": "path",
      "ref": ".flywheel/audit/flywheel-i18f/evidence.md"
    },
    {
      "type": "command",
      "ref": ".flywheel/audit/flywheel-i18f/l112-probe.sh"
    },
    {
      "type": "command",
      "ref": "rg -n \"RU-backed|~/.config/ru/config|~/.config/ru/repos.d/\\\\*\\\\.txt\" INCIDENTS.md"
    },
    {
      "type": "bead_id",
      "ref": "flywheel-i18f"
    }
  ],
  "artifact_checks": [
    {
      "artifact_id": "incident-entry",
      "path": "INCIDENTS.md",
      "status": "exists"
    },
    {
      "artifact_id": "evidence",
      "path": ".flywheel/audit/flywheel-i18f/evidence.md",
      "status": "exists"
    },
    {
      "artifact_id": "l112-probe",
      "path": ".flywheel/audit/flywheel-i18f/l112-probe.sh",
      "status": "exists"
    }
  ],
  "runtime_context": {
    "agent_context": {
      "status": "responsive",
      "probe_ref": "codex-pane updated INCIDENTS.md breadth-first substrate inventory checklist with RU config roots",
      "resolved_tools": [
        "br",
        "rg",
        "socraticode",
        "apply_patch",
        "ntm"
      ]
    },
    "orchestrator_shell_context": {
      "status": "responsive",
      "probe_ref": "callback target flywheel:1 per dispatch",
      "resolved_tools": [
        "ntm"
      ]
    },
    "timeout": false,
    "timeout_seconds": 0,
    "context_drift": false
  },
  "agent_mail": {
    "agent_mail_thread": null,
    "identity_name": "MistyCliff",
    "files_reserved": [
      "INCIDENTS.md",
      ".flywheel/audit/flywheel-i18f",
      ".beads/issues.jsonl"
    ],
    "files_released": [
      "INCIDENTS.md",
      ".flywheel/audit/flywheel-i18f",
      ".beads/issues.jsonl"
    ],
    "reservation_conflicts": [],
    "reservation_lifecycle": {
      "state": "released",
      "reason": "Reserved incident, audit, and bead surfaces before commit; released before callback."
    }
  },
  "evidence_redaction": {
    "evidence_redacted": "n/a",
    "required": false,
    "evidence_paths": [
      ".flywheel/audit/flywheel-i18f/evidence.md"
    ],
    "status": "pass",
    "owner": "MistyCliff",
    "remediation": "No secret-bearing evidence captured."
  },
  "bead_actions": [
    {
      "action": "none",
      "reason": "Existing bead flywheel-i18f is the tracked work item; no new gap found."
    }
  ],
  "learn_route": {
    "route": "ignore",
    "reason": "No new reusable skill discovery; this was a scoped incident checklist update."
  },
  "chain_blocker": {
    "next_phase": null,
    "capacity_available": false,
    "chain_blocked_reason": null
  }
}
