{
  "schema_version": "validation-receipt/v1",
  "dispatch_id": "flywheel-2xmq.3-ec654d",
  "callback_ref": {
    "transport": "manual_fixture",
    "session": "flywheel",
    "pane": 1,
    "kind": "DONE",
    "received_at": "2026-05-09T06:44:30Z",
    "raw_ref": "pending ntm callback"
  },
  "status": "pass",
  "failure_class": null,
  "retry_policy": "none",
  "recovery_hint": "None.",
  "failure_classes": [],
  "evidence": [
    {
      "type": "path",
      "ref": ".flywheel/audit/flywheel-2xmq.3/evidence.md"
    },
    {
      "type": "command",
      "ref": ".flywheel/audit/flywheel-2xmq.3/l112-probe.sh"
    },
    {
      "type": "bead_id",
      "ref": "flywheel-2xmq.3"
    }
  ],
  "artifact_checks": [
    {
      "artifact_id": "mission-lock-schema-example",
      "path": ".flywheel/validation-schema/v1/examples/mission-lock-schema.example.json",
      "status": "exists"
    },
    {
      "artifact_id": "skills-best-practices-schema-example",
      "path": ".flywheel/validation-schema/v1/examples/skills-best-practices-schema.example.json",
      "status": "exists"
    },
    {
      "artifact_id": "mission-lock-command-reference",
      "path": "/Users/josh/.claude/commands/flywheel/mission-lock.md",
      "status": "exists"
    },
    {
      "artifact_id": "skills-best-practices-command-reference",
      "path": "/Users/josh/.claude/commands/flywheel/skills-best-practices.md",
      "status": "exists"
    }
  ],
  "runtime_context": {
    "agent_context": {
      "status": "responsive",
      "probe_ref": "codex-pane added slash-command schema examples and command references",
      "resolved_tools": ["git", "br", "jq", "python3", "rg", "socraticode", "ntm"]
    },
    "orchestrator_shell_context": {
      "status": "responsive",
      "probe_ref": "callback target flywheel:1 per dispatch",
      "resolved_tools": ["ntm"]
    },
    "timeout": false,
    "timeout_seconds": 0,
    "context_drift": false
  },
  "agent_mail": {
    "agent_mail_thread": null,
    "identity_name": "MistyCliff",
    "files_reserved": [
      "/Users/josh/.claude/commands/flywheel/mission-lock.md",
      "/Users/josh/.claude/commands/flywheel/skills-best-practices.md",
      ".flywheel/validation-schema/v1/examples/mission-lock-schema.example.json",
      ".flywheel/validation-schema/v1/examples/skills-best-practices-schema.example.json",
      ".flywheel/audit/flywheel-2xmq.3",
      ".beads/issues.jsonl"
    ],
    "files_released": [
      "/Users/josh/.claude/commands/flywheel/mission-lock.md",
      "/Users/josh/.claude/commands/flywheel/skills-best-practices.md",
      ".flywheel/validation-schema/v1/examples/mission-lock-schema.example.json",
      ".flywheel/validation-schema/v1/examples/skills-best-practices-schema.example.json",
      ".flywheel/audit/flywheel-2xmq.3",
      ".beads/issues.jsonl"
    ],
    "reservation_conflicts": [
      "/Users/josh/.claude/commands/flywheel/skills-best-practices.md initially held by flywheel-2xmq.2-671cc0; coordinated release from pane 2 before edit"
    ],
    "reservation_lifecycle": {
      "state": "released",
      "reason": "Reserved shared command/schema/audit/beads paths before commit; release is verified before callback."
    }
  },
  "evidence_redaction": {
    "evidence_redacted": "n/a",
    "required": false,
    "evidence_paths": [".flywheel/audit/flywheel-2xmq.3/evidence.md"],
    "status": "pass",
    "owner": "MistyCliff",
    "remediation": "No secret-bearing evidence captured."
  },
  "bead_actions": [
    {
      "action": "none",
      "reason": "Existing bead flywheel-2xmq.3 is the tracked work item; no new gap found."
    }
  ],
  "learn_route": {
    "route": "ignore",
    "reason": "No reusable skill discovery; this is a direct schema-example documentation closeout."
  },
  "chain_blocker": {
    "next_phase": null,
    "capacity_available": false,
    "chain_blocked_reason": null
  }
}
